{"$schema":"https://json-schema.org/draft/2020-12/schema","$id":"concept.schema.json","type":"object","additionalProperties":false,"required":["id","topicId","label","description","aliases"],"properties":{"id":{"type":"string","minLength":1,"maxLength":128},"topicId":{"type":"string","minLength":1,"maxLength":128},"label":{"type":"string","minLength":1,"maxLength":120},"description":{"type":"string","minLength":1,"maxLength":800},"aliases":{"type":"array","items":{"type":"string","minLength":1,"maxLength":120},"uniqueItems":true,"maxItems":100},"parentConceptIds":{"type":"array","items":{"type":"string","minLength":1,"maxLength":128},"uniqueItems":true,"maxItems":100},"prerequisiteConceptIds":{"type":"array","items":{"type":"string","minLength":1,"maxLength":128},"uniqueItems":true,"maxItems":100}}}
