[
  {
    "id": "concept-0171abdb5ca74b29a4b2",
    "topicId": "ai-agents-future-work",
    "label": "Agentic Loop",
    "description": "A repetitive process where an AI agent assesses information, decides on a task, executes a tool, and observes the outcome.",
    "aliases": [
      "reason-act-observe loop"
    ],
    "parentConceptIds": [],
    "prerequisiteConceptIds": []
  },
  {
    "id": "concept-03e942734f24318ef1b1",
    "topicId": "ai-agents-future-work",
    "label": "Institutional Preparedness",
    "description": "The administrative and policy-based readiness of entities to address emerging challenges.",
    "aliases": [],
    "parentConceptIds": [],
    "prerequisiteConceptIds": []
  },
  {
    "id": "concept-042ec5df065def89a634",
    "topicId": "ai-agents-future-work",
    "label": "Hybrid Developer Role",
    "description": "A position requiring proficiency in both business analysis and technical software development tasks.",
    "aliases": [
      "Business-Analyst/Dev"
    ],
    "parentConceptIds": [],
    "prerequisiteConceptIds": []
  },
  {
    "id": "concept-04ff9e8cfbec03ce908f",
    "topicId": "ai-agents-future-work",
    "label": "ROI in AI",
    "description": "The measure of financial value generated by AI implementations relative to cost.",
    "aliases": [
      "Return on Investment"
    ],
    "parentConceptIds": [],
    "prerequisiteConceptIds": []
  },
  {
    "id": "concept-058b3ef1740aa3c22102",
    "topicId": "ai-agents-future-work",
    "label": "Capital Accumulation",
    "description": "The growth of financial or physical assets used to produce goods and services.",
    "aliases": [
      "Capital Formation"
    ],
    "parentConceptIds": [],
    "prerequisiteConceptIds": []
  },
  {
    "id": "concept-066ebb84473b4eb7c990",
    "topicId": "ai-agents-future-work",
    "label": "AI Chatbot",
    "description": "Conversational AI models designed to answer queries, explain, and summarize information.",
    "aliases": [
      "LLM-powered assistants"
    ],
    "parentConceptIds": [],
    "prerequisiteConceptIds": []
  },
  {
    "id": "concept-069bce3deb26e52aed97",
    "topicId": "ai-agents-future-work",
    "label": "Aggregate Demand",
    "description": "The total demand for goods and services in an economy, characterized by the speaker as reliant on wage, property, and transfer income streams.",
    "aliases": [
      "Household Income"
    ],
    "parentConceptIds": [],
    "prerequisiteConceptIds": []
  },
  {
    "id": "concept-08156dbe9ff50d54aaef",
    "topicId": "ai-agents-future-work",
    "label": "Paradigm Shift",
    "description": "A fundamental change in approach or underlying assumptions.",
    "aliases": [
      "Structural change"
    ],
    "parentConceptIds": [],
    "prerequisiteConceptIds": []
  },
  {
    "id": "concept-081654cb6a9c142ff991",
    "topicId": "ai-agents-future-work",
    "label": "Evals",
    "description": "Systematic testing, benchmarking, and quality assessment processes for AI model performance.",
    "aliases": [
      "Evaluation frameworks"
    ],
    "parentConceptIds": [],
    "prerequisiteConceptIds": []
  },
  {
    "id": "concept-083f7d4ed19eb1dee590",
    "topicId": "ai-agents-future-work",
    "label": "Claws",
    "description": "An emerging architectural layer for AI agents focused on advanced persistence, scheduling, and tool orchestration.",
    "aliases": [
      "AI agent orchestrators"
    ],
    "parentConceptIds": [],
    "prerequisiteConceptIds": []
  },
  {
    "id": "concept-084a7942fbbec6506b91",
    "topicId": "ai-agents-future-work",
    "label": "AI Exposure",
    "description": "The degree to which job tasks within a role can be performed or assisted by AI technologies.",
    "aliases": [
      "Automation susceptibility"
    ],
    "parentConceptIds": [],
    "prerequisiteConceptIds": []
  },
  {
    "id": "concept-092e855bb196ff23371f",
    "topicId": "ai-agents-future-work",
    "label": "Human-Centric Design",
    "description": "A design philosophy that prioritizes human needs, capabilities, and well-being within a system or organizational workflow.",
    "aliases": [],
    "parentConceptIds": [],
    "prerequisiteConceptIds": []
  },
  {
    "id": "concept-0ab37c8e4a2ef4607964",
    "topicId": "ai-agents-future-work",
    "label": "Unemployment",
    "description": "The state of being out of work while actively seeking employment, a key metric for measuring economic harm.",
    "aliases": [
      "Job loss",
      "displaced workers"
    ],
    "parentConceptIds": [],
    "prerequisiteConceptIds": []
  },
  {
    "id": "concept-0ac7518c1fa1e9c3f13c",
    "topicId": "ai-agents-future-work",
    "label": "AI Lead",
    "description": "A suggested professional role responsible for managing and creating specific AI agents within a department.",
    "aliases": [
      "AI Manager"
    ],
    "parentConceptIds": [],
    "prerequisiteConceptIds": []
  },
  {
    "id": "concept-0af7f536dd9112c7159b",
    "topicId": "ai-agents-future-work",
    "label": "System Reliability",
    "description": "The ability of an automated system to consistently perform its intended function without failure or error.",
    "aliases": [
      "system stability"
    ],
    "parentConceptIds": [],
    "prerequisiteConceptIds": []
  },
  {
    "id": "concept-0b022444d43e9919f4af",
    "topicId": "ai-agents-future-work",
    "label": "Economic Productivity",
    "description": "A measure of the efficiency of production, often enhanced by technological adoption.",
    "aliases": [
      "productivity boom"
    ],
    "parentConceptIds": [],
    "prerequisiteConceptIds": []
  },
  {
    "id": "concept-0c7d337a1546a9a8f555",
    "topicId": "ai-agents-future-work",
    "label": "Software Engineering",
    "description": "The systematic application of engineering to the development of software.",
    "aliases": [
      "Coding",
      "SWE"
    ],
    "parentConceptIds": [],
    "prerequisiteConceptIds": []
  },
  {
    "id": "concept-0c93859ffb25b69df552",
    "topicId": "ai-agents-future-work",
    "label": "Great Decoupling",
    "description": "The term used by the speaker to describe the phenomenon of GDP growth separating from wage employment due to technological advancement.",
    "aliases": [
      "The Decoupling"
    ],
    "parentConceptIds": [],
    "prerequisiteConceptIds": []
  },
  {
    "id": "concept-0ca36a73b0828a465e70",
    "topicId": "ai-agents-future-work",
    "label": "Private Credit Market",
    "description": "Financial sectors involving lending to private entities, often backed by recurring revenue streams.",
    "aliases": [
      "debt markets"
    ],
    "parentConceptIds": [],
    "prerequisiteConceptIds": []
  },
  {
    "id": "concept-0d4cf6ad9a4f3d071dd3",
    "topicId": "ai-agents-future-work",
    "label": "Supervised Fine-Tuning",
    "description": "Training a base model on manually curated datasets of questions and answers to adapt it to specific task formats.",
    "aliases": [
      "SFT"
    ],
    "parentConceptIds": [],
    "prerequisiteConceptIds": []
  },
  {
    "id": "concept-0dc8449029c5ecd5fee4",
    "topicId": "ai-agents-future-work",
    "label": "Professional Adaptability",
    "description": "The capacity of workers to adjust their skills and workflows to changing technology.",
    "aliases": [
      "Reskilling"
    ],
    "parentConceptIds": [],
    "prerequisiteConceptIds": []
  },
  {
    "id": "concept-0e28bc1a68759103bb3c",
    "topicId": "ai-agents-future-work",
    "label": "Goal-Oriented Planning",
    "description": "A framework where an AI identifies necessary actions to complete a user-defined objective.",
    "aliases": [
      "Strategic Planning"
    ],
    "parentConceptIds": [],
    "prerequisiteConceptIds": []
  },
  {
    "id": "concept-0edcc8fa21fb74861a49",
    "topicId": "ai-agents-future-work",
    "label": "Technological Unemployment",
    "description": "The loss of jobs caused by technological change, particularly automation, leading to a surplus of labor and potential structural inequality.",
    "aliases": [
      "labor displacement",
      "structural unemployment"
    ],
    "parentConceptIds": [],
    "prerequisiteConceptIds": []
  },
  {
    "id": "concept-10c3473eccac75c8ee2a",
    "topicId": "ai-agents-future-work",
    "label": "Grounded AI",
    "description": "An approach in which an AI system's output is anchored to specific external datasets to provide context-aware responses.",
    "aliases": [
      "Evidence-based generation"
    ],
    "parentConceptIds": [],
    "prerequisiteConceptIds": []
  },
  {
    "id": "concept-143170fe62166819e874",
    "topicId": "ai-agents-future-work",
    "label": "AI Labs",
    "description": "Organizations responsible for the research, development, and deployment of frontier artificial intelligence models.",
    "aliases": [
      "AI research institutions"
    ],
    "parentConceptIds": [],
    "prerequisiteConceptIds": []
  },
  {
    "id": "concept-1644362afea001461594",
    "topicId": "ai-agents-future-work",
    "label": "Orchestration Platform",
    "description": "A layer described as managing and coordinating workflows between multiple agents or applications.",
    "aliases": [
      "orchestrator"
    ],
    "parentConceptIds": [],
    "prerequisiteConceptIds": []
  },
  {
    "id": "concept-16ca7770bbe19fef5ffc",
    "topicId": "ai-agents-future-work",
    "label": "Agent Communication Interface",
    "description": "A term used by the speaker to describe how AI agents interact with SaaS APIs.",
    "aliases": [
      "ACI"
    ],
    "parentConceptIds": [],
    "prerequisiteConceptIds": []
  },
  {
    "id": "concept-16cb8a02338a2a2bd719",
    "topicId": "ai-agents-future-work",
    "label": "Reproducibility",
    "description": "The capacity of a research study to be repeated by others with the same results, often cited as a priority in academic settings.",
    "aliases": [